{
  "schemaVersion": "0.1",
  "generatedAt": "2026-08-18T00:00:00.000Z",
  "generator": {
    "name": "dsh-gate",
    "version": "0.4.0-alpha.3"
  },
  "baseline": {
    "dshVersion": "0.1.0-rc.7",
    "platform": "linux-x64"
  },
  "counts": {
    "pass": 0,
    "warn": 9,
    "fail": 3,
    "error": 0
  },
  "entries": [
    {
      "id": "chenw2759-wq-dsh-plugin-healthcheck",
      "displayName": "dsh-plugin-healthcheck",
      "target": "https://github.com/chenw2759-wq/dsh-plugin-healthcheck",
      "repository": "https://github.com/chenw2759-wq/dsh-plugin-healthcheck",
      "packagePath": "package.json",
      "categories": [
        "observability"
      ],
      "status": "warn",
      "receipt": {
        "schemaVersion": "0.3",
        "generatedAt": "2026-08-18T00:00:00.000Z",
        "verifier": {
          "name": "dsh-gate",
          "version": "0.4.0-alpha.3"
        },
        "target": {
          "kind": "github",
          "reference": "https://github.com/chenw2759-wq/dsh-plugin-healthcheck",
          "ref": "main",
          "packagePath": "package.json",
          "commitSha": "0d29936305a1649a08625d70066d0c2c3ef1700b",
          "packageBlobSha": "b48d775116f8ae5c871352c257d873d048ca1ca5",
          "repositoryId": 1333829912,
          "license": "MIT",
          "archived": false
        },
        "baseline": {
          "dshVersion": "0.1.0-rc.7",
          "platform": "linux-x64"
        },
        "plugin": {
          "id": "dsh-plugin-healthcheck",
          "version": "0.1.0",
          "description": "DSH 插件健康检查：设置面板内的「插件检测」向导 — L0 静态检查（files 白名单/依赖声明/高危副本/依赖可解析/Windows 命令/lockfile 一致性）+ L1 配置组合检查 + L2 隔离试跑（子进程 boot 全树），发现即自动回滚（写 home patch 前弹确认），复杂问题打包预制提示词交给 agent 修复。铁律：只修改插件代码与配置层，严禁修改 harness 源码。",
          "permissions": []
        },
        "status": "warn",
        "checks": [
          {
            "id": "package.identity",
            "status": "pass",
            "summary": "dsh-plugin-healthcheck@0.1.0 identified."
          },
          {
            "id": "dsh.peer-compatibility",
            "status": "pass",
            "summary": "All official DSH peer ranges accept 0.1.0-rc.7."
          },
          {
            "id": "gate.compatibility",
            "status": "not-run",
            "summary": "No explicit dsh.gate.compatibleWith range was declared."
          },
          {
            "id": "gate.platform",
            "status": "pass",
            "summary": "No platform restriction was declared."
          },
          {
            "id": "gate.permissions",
            "status": "pass",
            "summary": "Declared: none; no high-signal permissions inferred."
          },
          {
            "id": "source.provenance",
            "status": "pass",
            "summary": "Source read from https://github.com/chenw2759-wq/dsh-plugin-healthcheck at 0d29936305a1649a08625d70066d0c2c3ef1700b (package.json)."
          },
          {
            "id": "package.pack-smoke",
            "status": "not-run",
            "summary": "Pack smoke was not requested; use --smoke to run npm pack with scripts disabled."
          }
        ],
        "findings": [
          {
            "code": "gate.manifest-missing",
            "severity": "warning",
            "message": "No dsh.gate manifest is declared; compatibility and permission results will be inferred."
          }
        ],
        "notes": [
          "This alpha performs static checks and an optional npm pack dry-run; it does not execute plugin install scripts or claim a security audit.",
          "A passing receipt means the declared contract and selected smoke checks passed for this baseline, platform, and source ref."
        ]
      }
    },
    {
      "id": "dsh-market-dsh-market",
      "displayName": "dsh-market",
      "target": "https://github.com/dsh-market/dsh-market",
      "repository": "https://github.com/dsh-market/dsh-market",
      "packagePath": "package.json",
      "categories": [
        "market"
      ],
      "status": "warn",
      "receipt": {
        "schemaVersion": "0.3",
        "generatedAt": "2026-08-18T00:00:00.000Z",
        "verifier": {
          "name": "dsh-gate",
          "version": "0.4.0-alpha.3"
        },
        "target": {
          "kind": "github",
          "reference": "https://github.com/dsh-market/dsh-market",
          "ref": "main",
          "packagePath": "package.json",
          "commitSha": "56d937860b9b8b01f6b986bfaafd972476c0a7bf",
          "packageBlobSha": "9f6dc8b328b047382fc66f1132c8cd89d40745fd",
          "repositoryId": 1333807290,
          "license": "MIT",
          "archived": false
        },
        "baseline": {
          "dshVersion": "0.1.0-rc.7",
          "platform": "linux-x64"
        },
        "plugin": {
          "id": "dshmarket",
          "version": "1.11.3",
          "description": "Visual plugin market inside DeepSeek Harness — browse, search, and one-click install community plugins. · DSH 可视化插件市场：逛一逛，点一下，装好。",
          "permissions": []
        },
        "status": "warn",
        "checks": [
          {
            "id": "package.identity",
            "status": "pass",
            "summary": "dshmarket@1.11.3 identified."
          },
          {
            "id": "dsh.peer-compatibility",
            "status": "not-run",
            "summary": "No @deepseek-ai/* peer dependency range was declared."
          },
          {
            "id": "gate.compatibility",
            "status": "not-run",
            "summary": "No explicit dsh.gate.compatibleWith range was declared."
          },
          {
            "id": "gate.platform",
            "status": "pass",
            "summary": "No platform restriction was declared."
          },
          {
            "id": "gate.permissions",
            "status": "pass",
            "summary": "Declared: none; no high-signal permissions inferred."
          },
          {
            "id": "source.provenance",
            "status": "pass",
            "summary": "Source read from https://github.com/dsh-market/dsh-market at 56d937860b9b8b01f6b986bfaafd972476c0a7bf (package.json)."
          },
          {
            "id": "package.pack-smoke",
            "status": "not-run",
            "summary": "Pack smoke was not requested; use --smoke to run npm pack with scripts disabled."
          }
        ],
        "findings": [
          {
            "code": "gate.manifest-missing",
            "severity": "warning",
            "message": "No dsh.gate manifest is declared; compatibility and permission results will be inferred."
          },
          {
            "code": "dsh.peer-range-missing",
            "severity": "warning",
            "message": "No official DSH peer dependency range was declared; compatibility is not mechanically bounded."
          }
        ],
        "notes": [
          "This alpha performs static checks and an optional npm pack dry-run; it does not execute plugin install scripts or claim a security audit.",
          "A passing receipt means the declared contract and selected smoke checks passed for this baseline, platform, and source ref."
        ]
      }
    },
    {
      "id": "huanlinoto-dsh-plugin-interpreters",
      "displayName": "dsh-plugin-interpreters",
      "target": "https://github.com/HuanLinOTO/dsh-plugin-interpreters",
      "repository": "https://github.com/HuanLinOTO/dsh-plugin-interpreters",
      "packagePath": "package.json",
      "categories": [
        "runtime"
      ],
      "status": "fail",
      "receipt": {
        "schemaVersion": "0.3",
        "generatedAt": "2026-08-18T00:00:00.000Z",
        "verifier": {
          "name": "dsh-gate",
          "version": "0.4.0-alpha.3"
        },
        "target": {
          "kind": "github",
          "reference": "https://github.com/HuanLinOTO/dsh-plugin-interpreters",
          "ref": "master",
          "packagePath": "package.json",
          "commitSha": "dded3018d8f1e44142be8f845d23b7d559c8da52",
          "packageBlobSha": "c9c75a94572045f1125976d3c2a3d37e194c2b0f",
          "repositoryId": 1331842107,
          "license": "NOASSERTION",
          "archived": false
        },
        "baseline": {
          "dshVersion": "0.1.0-rc.7",
          "platform": "linux-x64"
        },
        "plugin": {
          "id": "@huanlin/dsh-plugin-interpreters",
          "version": "0.1.0",
          "description": "Exposes run_python and run_node tools with configurable interpreter paths; settings card (via /interpreters/api HTTP route) lets users set the executable locations.",
          "permissions": []
        },
        "status": "fail",
        "checks": [
          {
            "id": "package.identity",
            "status": "pass",
            "summary": "@huanlin/dsh-plugin-interpreters@0.1.0 identified."
          },
          {
            "id": "dsh.peer-compatibility",
            "status": "fail",
            "summary": "One or more official DSH peer ranges reject the baseline."
          },
          {
            "id": "gate.compatibility",
            "status": "not-run",
            "summary": "No explicit dsh.gate.compatibleWith range was declared."
          },
          {
            "id": "gate.platform",
            "status": "pass",
            "summary": "No platform restriction was declared."
          },
          {
            "id": "gate.permissions",
            "status": "pass",
            "summary": "Declared: none; no high-signal permissions inferred."
          },
          {
            "id": "source.provenance",
            "status": "pass",
            "summary": "Source read from https://github.com/HuanLinOTO/dsh-plugin-interpreters at dded3018d8f1e44142be8f845d23b7d559c8da52 (package.json)."
          },
          {
            "id": "package.pack-smoke",
            "status": "not-run",
            "summary": "Pack smoke was not requested; use --smoke to run npm pack with scripts disabled."
          }